<?xml version="1.0"?>
<!DOCTYPE BuildPattern PUBLIC "-//JAFFA//DTD Pattern 1.0//EN" "http://jaffa.sourceforge.net/DTD/pattern_1_0.dtd">

<BuildPattern>
  <Name>StoredProcedureCreatorPattern</Name>

  <PreRequesites>
  </PreRequesites>
    
  <Components>
    <Build>
      <Template>patterns/library/stored_procedure_creator_1_0/StoredProcedure.wm</Template>
      <Package>java.$(StoredProcedurePackage.Lower)</Package>
      <FileName>$(StoredProcedure.Upper1).java</FileName>
      <Override>Merge</Override>
    </Build>

    <Build>
      <Template>patterns/library/stored_procedure_creator_1_0/MetaObject.wm</Template>
      <Package>java.$(StoredProcedurePackage.Lower)</Package>
      <FileName>$(StoredProcedure.Upper1)Meta.java</FileName>
      <Override>Merge</Override>
    </Build>

    <Build>
      <Template>patterns/library/stored_procedure_creator_1_0/Resources.wm</Template>
      <Package>java.$(StoredProcedurePackage.Lower)</Package>
      <FileName>$(StoredProcedure.Upper1)Resources.properties</FileName>
      <Override>Merge</Override>
    </Build>
  </Components>
</BuildPattern>
		