<?xml version="1.0"?>
<!DOCTYPE BuildPattern PUBLIC "-//JAFFA//DTD Pattern 1.0//EN" "http://jaffa.sourceforge.net/DTD/pattern_1_0.dtd">

<BuildPattern>
    <Name>SkeletonComponentPattern</Name>

    <PreRequesites>
    </PreRequesites>
    
    <Components>
        <Build>
            <Template>patterns/library/skeleton_component_2_0/IComponent.wm</Template>
            <Package>java.$(BasePackage.Lower).components.$(Component.Lower)</Package>
            <FileName>I$(Component.Upper1).java</FileName>
            <Override>False</Override>
        </Build>
    
        <Build>
            <Template>patterns/library/skeleton_component_2_0/ComponentTx.wm</Template>
            <Package>java.$(BasePackage.Lower).components.$(Component.Lower).tx</Package>
            <FileName>$(Component.Upper1)Tx.java</FileName>
            <Override>False</Override>
        </Build>
    
        <Build>
            <Template>patterns/library/skeleton_component_2_0/ComponentController.wm</Template>
            <Package>java.$(BasePackage.Lower).components.$(Component.Lower).ui</Package>
            <FileName>$(Component.Upper1)Component.java</FileName>
            <Override>False</Override>
        </Build>

        <Build>
            <Template>patterns/library/skeleton_component_2_0/ComponentForm.wm</Template>
            <Package>java.$(BasePackage.Lower).components.$(Component.Lower).ui</Package>
            <FileName>$(Component.Upper1)Form.java</FileName>
            <Override>False</Override>
        </Build>

        <Build>
            <Template>patterns/library/skeleton_component_2_0/ComponentAction.wm</Template>
            <Package>java.$(BasePackage.Lower).components.$(Component.Lower).ui</Package>
            <FileName>$(Component.Upper1)Action.java</FileName>
            <Override>False</Override>
        </Build>


#if ($Screens != null) #begin
#foreach $screen in $Screens.values() #begin
        <Build>
            <Template>patterns/library/skeleton_component_2_0/ComponentJSP.wm</Template>
            <Package>html.$(Application.Lower).$(Module.Lower).$(Component.Lower)</Package>
            <FileName>$(screen.ScreenName.Lower1).jsp</FileName>
            <Override>False</Override>
        </Build>

#end
#end
        <Build>
            <Template>patterns/library/skeleton_component_2_0/ComponentContextNavJSP.wm</Template>
            <Package>html.$(Application.Lower).$(Module.Lower).$(Component.Lower)</Package>
            <FileName>contextNav.jsp</FileName>
            <Override>False</Override>
        </Build>

        <Build>
            <Template>patterns/library/skeleton_component_2_0/ComponentDefaultNavJSP.wm</Template>
            <Package>html.$(Application.Lower).$(Module.Lower).$(Component.Lower)</Package>
            <FileName>defaultNav.jsp</FileName>
            <Override>False</Override>
        </Build>

        <Build>
            <Template>patterns/library/skeleton_component_2_0/ComponentDefinitionXML.wm</Template>
            <Package>java.$(BasePackage.Lower).components.$(Component.Lower)</Package>
            <FileName>ComponentDefinition.xfragment</FileName>
            <Override>False</Override>
        </Build>

        <Build>
            <Template>patterns/library/skeleton_component_2_0/ComponentStrutsFormBeanXML.wm</Template>
            <Package>java.$(BasePackage.Lower).components.$(Component.Lower)</Package>
            <FileName>StrutsConfigFormBean.xfragment</FileName>
            <Override>False</Override>
        </Build>
    
        <Build>
            <Template>patterns/library/skeleton_component_2_0/ComponentStrutsGlobalForwardXML.wm</Template>
            <Package>java.$(BasePackage.Lower).components.$(Component.Lower)</Package>
            <FileName>StrutsConfigGlobalForward.xfragment</FileName>
            <Override>False</Override>
        </Build>
    
        <Build>
            <Template>patterns/library/skeleton_component_2_0/ComponentStrutsActionXML.wm</Template>
            <Package>java.$(BasePackage.Lower).components.$(Component.Lower)</Package>
            <FileName>StrutsConfigAction.xfragment</FileName>
            <Override>False</Override>
        </Build>
    
        <Build>
            <Template>patterns/library/skeleton_component_2_0/ComponentTilesDefinitions.wm</Template>
            <Package>java.$(BasePackage.Lower).components.$(Component.Lower)</Package>
            <FileName>ComponentTilesDefinitions.xfragment</FileName>
            <Override>False</Override>
        </Build>
        
        <Build>
            <Template>patterns/library/skeleton_component_2_0/ApplicationResources.wm</Template>
            <Package>java.$(BasePackage.Lower).components.$(Component.Lower)</Package>
            <FileName>ApplicationResources.properties</FileName>
            <Override>False</Override>
        </Build>
    </Components>
</BuildPattern>
