<?xml version="1.0"?>
<!DOCTYPE BuildPattern PUBLIC "-//JAFFA//DTD Pattern 1.0//EN" "http://jaffa.sourceforge.net/DTD/pattern_1_0.dtd">

<BuildPattern>
    <Name>SkeletonComponentPattern</Name>

    <PreRequesites>
    </PreRequesites>
    
    <Components>
        <Build>
            <Template>patterns/library/skeleton_component_1_0/IComponent.wm</Template>
            <Package>java.$(BasePackage.Lower).components.$(Component.Lower)</Package>
            <FileName>I$(Component.Upper1).java</FileName>
            <Override>True</Override>
        </Build>
    
        <Build>
            <Template>patterns/library/skeleton_component_1_0/ComponentTx.wm</Template>
            <Package>java.$(BasePackage.Lower).components.$(Component.Lower).tx</Package>
            <FileName>$(Component.Upper1)Tx.java</FileName>
            <Override>True</Override>
        </Build>
    
        <Build>
            <Template>patterns/library/skeleton_component_1_0/ComponentController.wm</Template>
            <Package>java.$(BasePackage.Lower).components.$(Component.Lower).ui</Package>
            <FileName>$(Component.Upper1)Component.java</FileName>
            <Override>True</Override>
        </Build>


#if ($Screens != null) #begin
#foreach $screen in $Screens.values() #begin
#if ($(screen.ScreenName) != null) #begin
#set $wm_form = "$(Component.Upper1)$(screen.ScreenName.Upper1)Form.java"
#else
#set $wm_form = "$(Component.Upper1)Form.java"
#end
        <Build>
            <Template>patterns/library/skeleton_component_1_0/ComponentForm.wm</Template>
            <Package>java.$(BasePackage.Lower).components.$(Component.Lower).ui</Package>
            <FileName>$wm_form</FileName>
            <Override>True</Override>
        </Build>

#end
#end


#if ($Screens != null) #begin
#foreach $screen in $Screens.values() #begin
#if ($(screen.ScreenName) != null) #begin
#set $wm_action = "$(Component.Upper1)$(screen.ScreenName.Upper1)Action.java"
#else
#set $wm_action = "$(Component.Upper1)Action.java"
#end
        <Build>
            <Template>patterns/library/skeleton_component_1_0/ComponentAction.wm</Template>
            <Package>java.$(BasePackage.Lower).components.$(Component.Lower).ui</Package>
            <FileName>$wm_action</FileName>
            <Override>True</Override>
        </Build>

#end
#end


#if ($Screens != null) #begin
#foreach $screen in $Screens.values() #begin
#if ($(screen.ScreenName) != null) #begin
#set $wm_jsp = "$(screen.ScreenName.Lower1).jsp"
#else
#set $wm_jsp = "default.jsp"
#end
        <Build>
            <Template>patterns/library/skeleton_component_1_0/ComponentJSP.wm</Template>
            <Package>html.$(Application.Lower).$(Module.Lower).$(Component.Lower).jsp</Package>
            <FileName>$wm_jsp</FileName>
            <Override>True</Override>
        </Build>

#end
#end
        <Build>
            <Template>patterns/library/skeleton_component_1_0/ComponentDefinitionXML.wm</Template>
            <Package>java.$(BasePackage.Lower).components.$(Component.Lower)</Package>
            <FileName>ComponentDefinition.xfragment</FileName>
            <Override>True</Override>
        </Build>

        <Build>
            <Template>patterns/library/skeleton_component_1_0/ComponentStrutsFormBeanXML.wm</Template>
            <Package>java.$(BasePackage.Lower).components.$(Component.Lower)</Package>
            <FileName>StrutsConfigFormBean.xfragment</FileName>
            <Override>True</Override>
        </Build>
    
        <Build>
            <Template>patterns/library/skeleton_component_1_0/ComponentStrutsGlobalForwardXML.wm</Template>
            <Package>java.$(BasePackage.Lower).components.$(Component.Lower)</Package>
            <FileName>StrutsConfigGlobalForward.xfragment</FileName>
            <Override>True</Override>
        </Build>
    
        <Build>
            <Template>patterns/library/skeleton_component_1_0/ComponentStrutsActionXML.wm</Template>
            <Package>java.$(BasePackage.Lower).components.$(Component.Lower)</Package>
            <FileName>StrutsConfigAction.xfragment</FileName>
            <Override>True</Override>
        </Build>
    
        <Build>
            <Template>patterns/library/skeleton_component_1_0/ApplicationResources.wm</Template>
            <Package>java.$(BasePackage.Lower).components.$(Component.Lower)</Package>
            <FileName>ApplicationResources.properties</FileName>
            <Override>True</Override>
        </Build>
    </Components>
</BuildPattern>
		